{
  "run_id": "2026-10-27T10-00-00Z-7f3a",
  "started_at": "2026-10-27T10:00:00Z",
  "finished_at": "2026-10-27T10:04:12Z",
  "git_sha": "0c193b7d1e3f4a5b6c7d8e9f0a1b2c3d4e5f6a7b",
  "build_id": "nightly-412",
  "engine": {"name": "godot", "version": "4.7.2"},
  "sdk_version": "0.1.0",
  "protocol": "glitchscout/1",
  "orchestrator_version": "0.3.0",
  "config_hash": "sha256:9f2c4e8a1b3d5f7092a4c6e8b0d2f4a6c8e0b2d4f6a8c0e2b4d6f8a0c2e4b6d8",
  "tests": ["qa/features/intro.feature:10", "qa/features/intro.feature:17:24"]
}
